selftext_title,is_suicide
understand people reply immediately op invitation talk privately mean help type response usually lead either disappointment disaster usually work quite differently say pm anytime casual social context huge admiration appreciation goodwill good citizenship many support others flag inappropriate content even know many struggling hard work behind scene information resource make easier give get quality help small start new wiki page explains detail much better respond public comment least gotten know someone maintained r depression wiki private contact full text current version summary anyone acting helper invite accepts private contact e pm chat kind offsite communication early conversion showing either bad intention bad judgement either way unwise trust pm anytime seems like kind generous offer might perfectly well meaning unless solid rapport established wise idea point consider offer accept invitation communicate privately posting supportive reply publicly help people op response good quality educate inspire helper rule http en wikipedia org wiki rule internet culture applies much anywhere else internet people struggling serious mental health issue often justifiably low tolerance disappointment high level ever changing emotional need unless helper able make commitment every way long necessary offering personal inbox resource likely harm good mental health crisis line responder usually give name caller allowed request specific responder much healthier safer caller develop relationship agency whole analogously much safer healthier ops develop relationship community whole even trained responder generally allowed work high intensity situation alone partly availability mostly wider perspective preventing compassion fatigue helper get head someone whose mental health issue including suicidality often comorbid depression escalate pm conversation much harder others including r depression r suicidewatch moderator help contrary common assumption moderator see police pm observation many year people say pm consistently one least understanding mental health issue mental health support gap knowledge ability communicate effectively community input mitigates limitation reason someone truly help would want hide response community scrutiny helper concerned privacy keep mind self disclosure used supportively feeling detail problem use alt throwaway account restriction account age karma know internet used people exploit abuse others people want hide deceptive manipulative response everyone except victim many specifically target vulnerable mental health issue helper invite op talk privately give good supportive experience primed person vulnerable abuser sort cognitive priming tends particularly effective someone state mental health crisis people rely heuristic critical reasoning ops want talk privately posting wide open anonymous forum like reddit might best option although recommend allow ops request private contact asking support want please keep expectation realistic careful look history anyone offer pm opening broken least understood rule helper may invite private contact first resort made new wiki explain,0
welcome r depression check post place take moment share going accomplishment want talk standalone post sub violate role model rule welcome tough time prefer make post place share try best keep space safe supportive possible reddit wide open anonymity friendly platform community rule found sidebar community info official mobile apps sure rule please ask u regular check post,0
worst time dealing pain know new pain quite literally light life one could turn talk one source real true love ripped away somehow received lightest injury involved even though vehicle hit side extremely high speed feel like going hard move life alone wife killed drunk driver last saturday funeral tomorrow,0
hey want share recent triumph thought killing imag ning way kill since beginning january march longest streak ever gone life sincerely sincerely heart wish best best redditors sub heart cannot stress enough truly truly wish everyone go day even one day without thinking suicide feeling little bit relief even day may know real life truly see friend wish joyful life love suicidal thought two month,0
want say fuck life fuck life,0
hate life itdo live person always brings,0
even know say blame loneliness cringeworthy overdramatic post friend checked one texted first would talking literally end depression occasional good mood day week quite literally back mental state,0
tired right really needed cry moment completely breakdown ever need cry minute help get currently going,0
u get bed go sleep realize tomorrow going better stay strong allthe night realization,0
matter school college home online something make people despise treat like repulsive thing ever know maybe awkward quiet ugly likely combo three relationship managed form turned nothing spent year nothing loneliness trying convince successful people world hire waste space part even want try fear anyone forced around immediately dislike really want end hope get courage soon think destined disliked,0
im laying bed alone saturday night one go closest friend occupied pick call maybe annoyed feel miserable want suffering end really need help dont think anybody would listen im mad tired trapped confused really funny feel emotion one push falling cliff someone jusy push already maybe im dead one notice,0
okay life falling apart tired cry deserve day without fuck cry today watch series eat snack see happens tomorrow might problem though wait see happens tomorrow instead making sure tomorrow better ah guess see going cry today,0
moment learned partner would lose baby felt like lost sense purpose always wanted dad soon university finished decided start trying baby long pair u sitting edge bed apprehensively waiting result appear pregnancy test felt like eternity pregnant flashed screen partner looked combination fear excitement together year half graduated felt perfect time baby settling world work seemed like everything going right first time life felt complete day soon arrived partner going see little baby first time week scan dressed especially wore suit partner wore lovely dress sat nervously waiting room lancaster royal infirmary shared baby name idea beautiful day sonographer rolled scanner across partner stomach eventually said sorry asked wrong explained issue baby development escorted grievance room consultant informed u baby condition called encephalocele skull never form properly asked whether chance survival fear confirmed tear fell completely numb partner sought second opinion want admit baby gone soon told decided accept medical management procedure witnessing partner lose child wanted much harrowing experience ever endured choke thinking procedure tried remain strong brave deserved somebody reassure everything would ok could thought rationally time baby taken away nothing could time live together made duty much possible developed inseparable bond started feel depressed face longer even considered taking life even refused seek help want burden loved one especially partner battling emotion worried told doctor would locked away thought could make thought disappear time became clear going happen point told partner felt weight lifted shoulder incredibly supportive even though disheartened keeping feeling sought professional help doctor help u come term loss even though midst mental health crisis still feel selfish contemplating suicide partner needed could thought rationally time baby taken away nothing could funeral service partner attended scattered ash memorial garden crematorium grateful partner since got married become parent beautiful baby boy called noah easy pregnancy noah partner incredibly cautious fond memory noah kicking hand cuddle wife anxious throughout really get fully enjoy experience scan would breathe sigh relief reached another milestone born cried hard mostly proud wife son combined emotion suppressed last pregnancy noah arm delivery room knew everything going fine often saw great friend child get thrill enjoyment yet found incredibly difficult bond noah initially want cuddle show affection feel normal petrified bonding felt lost would completely end became recluse avoided interacting anybody content sleeping felt empty merely existing wife quickly realised detached reality often talking blankly stare space taking anything said often saw great friend child get thrill enjoyment upset felt surely feeling way child noah couple month old wife convinced see doctor concluded dealing postpartum depression diagnosis even aware men could get postpartum depression however doctor explained normal prescribing antidepressant counselling session time gradually rebuilt confidence formed bond beautiful wonderful son lost first baby felt impossible move forward although never forget first child noah brings light back life nearly two intelligent much love give noah wife offer life sense purpose without know since going experience much open emotion friend family vowed wife got better would try help others showing paternal postpartum depression happen keep feeling particular raised fund awareness tigerlily trust local bereavement charity supported wife struggle provide tangible symbol remembrance parent bereaved miscarriage stillbirth neonatal death heard show u love support difficult time heartwarming time wife would love child always sense anxiety first experience firm believer time great healer enjoying beautiful son grow parent looking much look little one day first time father suffered postpartum depression wanted end life,0
attempted told one close friend friend told people yesterday argument another friend kept telling exhaust people reached kept making fun suicidal tendency repeating nuisance everyone involved feel sick stomach hopeless fuck people aware vulnerability humiliating reaching mistake,0
reality im fucking depressed dense see accept itmy parent think im possessed spirit,0
know know make difference really needed deposit thought tired life got real friend really feel connected anyone always like always odd one every social group felt sincerely understood find happiness thing anymore feel like monster miserable even know saying anymore point every day worse worse feel humiliated embarrassed got nothing one always outcast feel like supposed actually accident indeed found recently phase life going past year life tired fighting lying everyday thing get better stupid know nobody sincerely want listen struggle anything blame people care even professional get paid daily help cope kind thing actually care well end day nobody care simple always person go friend around even always person pick last team captain sport game notice gone fact care even happy even explicitly told wish gone good anything probably ever anything recognized offer nothing person anything feel like deadly weight people care everyday matter hard tried tried hardest time people like matter dislike tired life tired contemplating suicide figured know sooner later probably go though pain stronger emotion felt life yes tried med anything made harder naturally find joy thing amp x b see talented people commenting feeling way sincerely deserve world one people probably person deserves feel way miserable person wanted get feeling want know alone sincerely think deserve world ever wish pain anyone please read treat well sorry goodbye final thought wanted deposit feeling,0
person thought getting virus way die without committing suicide god depression suicidal idilations pain day upon hearing death brain hey one way going danger commenting thought illness give mecoronavirus,0
start year old male struggling live day day extreme boredom general apathy understand people live life day eye literally everything boring name seem boring pointless experience average day work eat shit sleep repeat every time try find form entertainment reality distraction get bored minute get headache sufficiently distracted every moment free time curse come thinking pointless everything apparently come pre installed standard life cycle instruction people fool form satisfaction would love able mindset keep self going every day option death seems like better option ball follow yet reason clearly like living every time bring boredom people shoot answer find like far see like anything living reason sorry make something gotta travel like traveling see point traveling x amount mile nothing somewhere else try new thing genius wonder never tried gotta work bro fro exercise nothing pain get dopamine endorphin people claim feel anyone give shit tried went gym consistently pretty much year lost weight kept still give shit people defend one till death reason everything make sense find right girl someone miserable yet human made feel anything besides feeling nothing best seen far passive person zero effect life sex drive general strong something much sure point somebody bring testosterone something want point getting laid sure ignored anyone even read generally see post gonna kill right title working usually get swept rug forget reproducing holy shit kid seems like fate worse death emphasize keep reproducing personally stand kid incoming swarm reproducer mean parent curse anyway drug drug drug anything moment working really missing cocktail pill maybe doubt fix general apathy boredom issue make stop wishing death guess something could probably go let see happens know sound testy honestly mindset getting much recently keep wanting see missing something pretty much screwed muster ball end sorry wasting time whomever may read everything boring pointless nothing interest,0
severe depression put state year dead six year want anything rest life,0
know stupid probably nobody really care get comment saying hi something kind want pretend friend dont really care upvotes anything like thatcan get comment,0
example constantly fear missing stuff friend feeling abandoned nobody like etc acting mean passive aggressively something spot im selfish isnt fault even though feel like end world im hurting people making people like make hate even selfish self centered feel like head splitting apart cause whatever think lead hating even feeling like piece shit person anybody ever make realization hate act,0
especially someone received absolutely zero support empathy people around even want anyone feel sorry want people understand hurting trying best keep together instead family turn around talk shit make feel worse already dealing mental health issue since year old exacerbated fact abused much childhood turned blind eye make angry seeing people use depression get attention social medium,0
struggled violently depression childhood riddled trauma pretend suffered anybody else ive read many book mental health done much change year ive finally gained courage live past burden use pain courage step forward found purpose decided create class school focused around mental health focus educate student improve mental health improve life anyone know even basic mental health emotional intelligence understand much knowledge improve someone life dramatic people improve life use knowledge know im absolutely certain work need someone point right direction research expert like reach doctor specialist field tip help get together data help organize pitch school perfect proper curriculum also need know go idea im tom river nj figured going town hall good start would talk ok till pitch idea reached last week principal nearby high school still responded keep trying anyone suggestion please hesitate tell anything might know anyone try discourage bother stubborn anyone ever met im insane doctor note prove stop know help save kid even help one worth giving absolute anyone know better subreddit post please let know thank supporthelp,0
feel like favorite thing sleep hate world set truly better time asleep life real world life suck filled depression loneliness bill stay got weed make awake lot bearabledo depressed people like sleeping actually awake,0
wake rush bus struggling wake im tired entire day shit sleeping habit eventually get excited get home actually get home happy hour untill reality shit as life kick mindless videogames barely enjoy anymore mindlessly scroll reddit basically actual hobby enjoy anymore barely eat dinner homework late time listen depressing music untill repeat another day get excited weekend spend nothing proactive mindless activity barely enjoy simply pas time honestly prefer school day weekend hour forgot life terrible bright future crippling laziness inability care enough fix terrible life style feel like life cycle,0
terrified post cant exactly state hit point low cusp panicking every moment feel detached feel completely alone want alone anymorei feel strangely delirious paranoid,0
woke morning looked around empty food container house dirty clothes bathroom floor week sink full dirty dish realised go living life way girlfriend live together would tell see someone always insisted fine finally realised need help life mess go living like everything struggle joy life anymore think time change get help finally ready admit need help,0
depressed month ago stood bridge could think family upset gone even day hurt family like wrote note would help move thought little brother know would blame forced get better forced get job well uni best always wanted wanted met someone patient beautiful second forced get better month dark sad cloud crawled way back head yes money loving family boyfriend help feel alone help want gone would much easier never existed first place nobody would miss nobody would blame self,0
made post like couple month ago showered since point literally care anymore talked family friend one point honestly considered ending see point boyfriend went deal something today way inspired want plan ahead future research reached people also worked tonight got work pm got home even think brushed hair got shower like wow glad maybe light end long curvy road washed hair tonight,0
diagnosed even know depression depressed like feeling comfortable stuck corner quite ok term life work friendship family relationship waking every day heavy feeling like verge cry consciously present talk people even family member showcase sad even process certain thing like small talk joke appear socially function like everybody else suicide scary think could time feel like living either thought popped head would event receive news limit life expectancy seriously considered anything proceed die feel like anything super sad depressed yet really want permanently disappear saying life comfortable aspect area life really suck legitimate problem becomes issue survivability yet feel heaviness hopelessness nearly everyday make feel like shit reason like people far justified depressed even soldier reason post go therapy want know people personally improve life thanks advancei want die feel like living,0
even energy say everything want take anymore one one helpful fucking hate swallowing pill every morning therapist seems tired shit professor need get head ass probably retaking class unless die hope ha ha,0
people around simply care try hard want feel good want make positive difference people life know throughout life told something wrong cannot happy ever since remember bullied wanting die since depression fucking hard get better always gonna get worse keep lying saying change im cursed like deserve example im continue,0
feel point anything really see point anything,0
know anymore cry three hour straight torn almost everything room cry help nobody ever come one ever hears cried tear feel empty nobody would miss even notice absence burden everyone wish never born earlier wished car would crash would die would selfish died today little brother birthday tomorrow big brother two day away week would selfish so selfish never wanted kill tonight,0
everything planned going drink bottle nail polish remover feel fucking awful time wanted end freaking would probably dying pain maybe dead still cry whole thing bit glad much live want happy want everyone happy reach help tell mom suicide attemp depression scared understand almost killed,0
hate become going long one buckle usual story normal childhood th grade mom became alcoholic rough experience high school dad work support u fend first suicide attempt thing got bit better around second suicide attempt losing job gf two year dropping school go psych clinical depression trouble keeping job getting back school meet amazing girl maintain job month make plan go back school gain muscle well past summer job causing much anxiety show gf break totally justified bc cant bring anything month still lost pound muscle month job struggling semester friend graduated college never invite blame sad outside one gf never liked circle always talk behind everyone back thing enjoy playing guitar writing music positive thing life friend like ex done going get bachelor least another two year sickly pale scrawny socially inept jobless living home depressed think beginning change today make decided delete social medium apps group chat talking friend snap instagram twitter reddit always hopelessly optimistic think life finally burnt sure point try far behind already met failed love life drive away friend burden family society skill talent worth try cheer please listen understand acknowledge way best always thought older get le ring true read thanks reading know anonymous internet user make u feel validated need today hug loved one beer watch movie better thank hate become,0
quite revelation lately constantly manipulating almost everyone know stop always thought adhd pay attention noticed thing remember thing interested remember birthday promise even conversation day clearly remember digit random key passcode relative ease told countless time try always acknowledge partner feeling think clearly mean every day seems convince trying think want emotional manipulation reason r depression seeing happen watching destroy partner somehow still find victim abuse instead want stop know escape manipulation stop thinking want die save believe change manipulate everyone naturally,0
wish could go completely absolutely insane normal sober thought mentally painful draining want drift away eternal madness could least comfortablei want delusional,0
ive never felt emptier contemplated suicide multiple time every month today tried telling parent need help denied bringing doctor saying dont believe medicine friend tease depression use extremely back handed sarcastic compliment regard depression literally one give shit honestly dont think anyone would care alive point im bare minimum survive eat breathe sleep isnt living hell surviving isnt living,0
teen girl used excited whenever parent went away every often would leave day time house sister life wake late come home dawn every day basically alone extremely introverted always thing used love anything else alone door shut tight could watch youtube read crochet play computer game day get pumped staying late wanted take extremely long time fall asleep like able disregard time thing feel like enjoy anything suddenly empty distraction feel really awful whenever parent go never say word find later used see pleasant surprise see far away sister set life see location feel incredibly lonely function alone pressure daily life high pressure school competitive go academy research outside work finally left alone one pushing automatically withdraw avoid responsibility used drift day feeling empty barely eating distracting everything get detached forget everyone else stay room day end return readjust part society worst part nothing time feel guilt gnawing incessantly get motivation move even typing hard fuck point even writing nothing anyone say ever fix feel mom died year old remember vividly moment saw coffin kicked dead someone loved gone forever world would keep spinning parent really loving step mom really old kid still teen dad mom shitty life chronic stress whenever look see image coffin exactly realistically memory birth mom scary real know every second pass running time spend cried much get anxiety every time see face selfish want stay alive time go know would welcome death life always really awful teen uncommon admit parent like anchor real world anxiety sometimes distorts perception make feel like one give shit family often feel like safe space matter disappear hurt much love unconditionally feel guilty inadequate person think parent death think go people ever love alone reminds real world everything hurt feel like really solution know pathetic sound right trust truth really immature inside still feel lost insecure world sometimes wish could grow fuck feel extremely depressed parent leave house,0
longer evaluate people attitude behavior towards everyone seems hate everyone something make sad although try treat people lovingly respectfully try make sad example friend crush others know long heart last cry almost every day people disgusting,0
finally find live gonna fuckin ripped lmaoy better watch,0
suffering bad depression hate life enjoy anything find hard open anyone even typing hard open anyone feel embarrassed ashamed even go doctor speak word come know doi open,0
want someone talk regularly friend side world literally australia hate alone time really pet one seem get feel like crap havei want friend,0
done nothing today laid bed phone mostly feel gross hungry much want shower eat nothing entertains interest cant make get move anything feel stuck totally paralyzed anyone advice anything help cant seem move paralyzed,0
