selftext_title,is_suicide
feeling upset mom talk want help feel yelling hard right help uh please worry going go room mom mom wanting help still yelling gee thanks feel much better ah yes thanks mom,0
hey want die go live bring self end anyone anything pray wake bye boy deleting social medium including redditkill,0
night come lay bed thinking stressful problem suddenly everything go dark conciseness go rest longer aware life death brain numb seize exist even moment start dreaming feel happy like time wer wake ready repeat boring routine thats bothering quite choice keep going best part day sleeping,0
really venting one talk depressed year little moment hope temporary happiness briefly connect people eventually depression take people connected start perceiving differently told lot become negative really intention like choosing sad time thing keeping going good school last fall graduate school hindsight really good idea everything started getting worse additional stress inability make friend failed class got dismissed school embarrassed tell anyone including family shut attempted suicide taking pill obviously work knew effective way done everything another option moment think therapy going help yes venting sometimes feel nice going change perspective life never optimistic happy person see happy future attractive really shape apparently smart thought one ever gonna give crap let alone love lovable sometimes imagine would like completely different person people life actually love care like day dreaming sometimes pretend pillow person love enough actually sleep next pathetic borderline crazy know keep hurting everywhere look see happy people happy couple people perfect life know never thatventing,0
find difficult right believe person depressed also simultaneously love heart wrenching music depressed also love music,0
like fuck home life awful seems like one supportive existing school life fine allowed drop time consuming high pressure subject everything lost think grade enough get want go friendship fine three friend felt close enough initiate conversation confusing hard manage relationship one finally counsellor school trying get help mental health service beyond counsellor support school home look like happen coordinator could happen school said would point meeting school help due leaving next month service long waiting list nothing feel side dont know post low key wish exist ya wtf,0
hi im hoping may able help background situation im early partner together coming year living together parent past year partner always struggled mental health past recently thing worse becomes angry quickly find joy anything jer day work stay room cry day try support way feel like help especially work recommended seeking professional help scared parent found would angry great come kind thing worried seems push away try help know else need advice depressed partner,0
tell gut feeling something bad happening anxious,0
suffer extreme lonliness endure depression tried get professional photo done photographer rude understanding hard smile look optimistic sound weird thing photographer understand depressed willing understanding insightful depressed photographer specializes working people depression,0
background pretty depressed like year struggle school personal family life gender identity really know bear responsibility depression started going therapy year ago eventually really stop feeling depressed stopped thinking suicide often one thing never really got better think ever got feeling back right ive graduated college bachelor im working ok job atm generally speaking life ok problem feel passion anything right feel emotionally numb almost time cant tell even need work feel better honestly dont feel bad anymore feel nothing honestly dont know im writing ive told people feel irl im really repeating post really sure read feeling anymore,0
constant state sadness past couple year life thought back head may depression doubted tried kill twice many thought looked symptom online related feel worthless burden everyone know thing year close relatively young anyone advice think depression diagnosed legit testing,0
hated growing going court house time attribute constant fighting back forth majority deal today able find joy anything constantly lying happiness pushing everyone away swore life day would never put child yet struggling find time involve struggling arguing bm everyday wanted family slowing losing sanity everyone around expect advice anyone really much say always tried find way see good getting much lately weight chest heavy lately feel like cry everyday cry held room everyone tell beginning everything get better know anymore trying whole life parent get cycle system put back family,0
post anyone share niceafter almost year cured depressed,0
today woke made breakfast rare fed applied lot job told people care love took old dish room washed much feel pretty accomplished mentally feel little exhausted making stride thankful feel okay today,0
feeling pass week later want kill feeling pass alive many year probably would better every week want kill,0
left house week go class get eat go therapy sitting front pc wondering still alive forcing go concert bought ticket feel like wasted money hard make move maybe need med know better anymorei thought getting better oh well,0
long remember feel feel happy see hear remember happiness make feel even depressed feel like sitting dark everyday time pass feel harder harder escape want sit battle every thought mind expend daily energy towards acting normal forgetting felt feel happy,0
taking year school work part time walmart car going paycheck paycheck live best friend mom house pay rent bedroom act living room whole lot privacy pretty poor social skill zero luck woman anyways also clinical depression anxiety ptsd dissociation dealt since small child therapy throughout childhood gotten significantly better coping though atm broke afford health insurance therapy med definitely afford pocket even sliding scale always trying improve though type let mental illness excuse let symptom run rampant let affect personal relationship much guy think honestly sureshould avoid dating current position life,0
around best friend gave sister number joke ended talking alot becoming really good friend around end summer admitted feeling best friend started hating didnt let come house often couldnt see much fine cause still texted called sadly october talked saying feeling like didnt like anymore kinda true didnt care really good friend thing like year didnt care anymore everytime said anything would say mhmm uh huh keep mind standard settle anything see godess even wanted friend atleast reaction told people care say shoudnt waste day ago told didnt wanna friend anymore im sure right choice sure ever since people actually care say acting distant whenever invite make fake reason say cant make friend actually rely anymore stayed friend would atleast wall talk stayed friend settled like dont know im really sad im smart dont know cant exactly make friend cause school full people like soccer like sport want friend sit beside watching tv doesnt care physical flaw hug im sad wont let either caring say wanting hang whenever im rock bottom ask reddit help normally dont care alone wanna hang someone finally realized cant dont know dowell im sad,0
feel people ignoring say friend become really popular whenever say hi call name either look like know flat disregard even talking barely friend stuck point crush seen desk going rough time ignores talked frequently seems care one friend thought friend leaked autistic adhd well take medication every day whenever walk around school people look laugh talking shit called freak leave school go mental asylum called mistake many time affecting emotionally physically making depression worse increased level anxiety anxiety attack since started everything around starting become meaningless nothing mom dog little brother give genuine source happiness people school made feel even worthless want feel accepted someone family consider friend family well people talk shit look strangely disregard maybe right maybe really mistake people starting ignore feel isolated like outcast,0
lately getting unreasonably angry thanks heavily biased content online taking posting thing neither meet sub guideline community friendly would like apologize state longer post sub thank patience apologize,0
zoloft nine month three month ago started taking adderall adhd find struggling depression think adderall anyone else advice feel like stop taking adderall,0
hating since high school short stupid even mentally disabled feel like never grew mentally bring pretty easily could happy confident one day bring next good place earlier thinking culinary class tomorrow sudden mind went negative nervous kinda scared bad tomorrow also assignment due next friday capstone outline psychology even done research job giving time think fell bad luck tree hit every branch feel like burden anything sometimes want end life hell thought want know exist thanks whoever read hate,0
run in counselor past call parent depressed every time parent yelled saying looking attention told thing wrong never believe tell get grade basically f horribly lately talked one teacher email counselor call given fake email mom old one lost password thinking telling got new phone giving friend phone number instead get trouble parent find really want avoid knowing anything counselor school calling parent,0
first post know anyone care read gonna post anyways clinical depression past couple year think everyone relate feeling hopelessness thinking thing like would feel better would much happier end thinking hole sadness feeling like nothing fix cycle repeat nothing change mainly experience depression lately making change life helping hope help someone find way get rid depression cope find way tackle everyday warning personally help saying right way everyone encourage try way handle day day life important get bed get say stand something besides laying bed tell everyday matter much want sit bed nothing sleep think problem know happy way something could make day seem productive like got something accomplished day laundry go run clean dish read book one thing putting even take long high get fulfilling day feeling like productive done something incomparable anything ever experienced talk someone matter much want reclusive keep express important social bond commuting others care friend u really literally talk coworker strike convo someone grocery line waiting checkout hell conversation uber driver communication expressing thought important part mental health talking people always make feel like none u truly alone world part collective group trying get call life together remind everyday worthy hardest thing struggle good thing happen instead feeling happy feel sad deserve suppose feel happy worthy worthy worthy living worthy love worthy attention useless piece shit think deserve happiness essential live fulfilling life cannot stress enough easier said done realize know took forever start thing realize truly making depressed hope though found inspiration try thank overcome cope depression everyday hope help guy,0
currently sitting ball dread anxiety wait college provost decide fate caught plagiarizing ever since got email accusation spirit fight anymore feel like fucked sabotaged pretty much ruined chance getting medical school want move want look people want alone thought know enough keep going everything look hopeless thought understood depression whole new level one put gun head ruined dream really hit differently year money school wasted hello rock bottom mind stay awhile really get,0
suffering depression year every single day painful getting better lately day day sense emptiness ending finally break free true deluding understood yesterday yesterday painful void inside constantly go room shed tear started cry much even breath happened yesterday lost hope going happy come think even goal almost live soulless body always made huge smile front family even come well day expression eye even everyone laughing remain expression try cover face ruin joyful atmosphere free,0
anyone sub diagnosed psychotic depression would like compare notespsychotic depression,0
substitute teacher meaning long work day month keep job otherwise get choose day want work according job online helping depression get bed take one two job week growing broke feel guilty able work daily job choosing guess know get vicious cycle working much work shitty feel depression choose schedule work,0
like eating disorder something really depressed period family really toxic usually would eat together bad argument mom completly stopped interacting still eat together treat like exist try make move towards going end argument would still leave food end know cook tryed still drink milk eat biscuit breakfast even desire eat sitting kitchen know could cook strenght around lunch time felt really bad pain stomach like gun would shot felt pain disapear nothing laid bed still hurt much know update thank much everyone lt okay might sound cheesy saw comment thought stranger took time write something let effort go waist like okay shut brain go like robot maybe think something else like create made situation listen music would stop negative taughts actually feel like energy thing really glad day stopped eating know eat,0
im uk got crippling depression anxiety going last year bit breakdown year ago kinda tried get help tried making appointment see doctor ring doctor make appointment doctor asks whats wrong like aint teh fuckin doctor bruh also dont feel comfortable talking someone personal shit phone cant see really answer saying im depressed wasnt allowed appointment got minute chat doctor phone asked question answered prescribed citalopram take month said touch finish also mailed leaflet therapy counselling whatever fuck never read guess didnt think would help pretty bad anxiety making phonecalls avoid cost never gonna willingly ring whole experinece made uncomfortable tbh never went back major underlying trauma cause illness ie im grieving would therapy still benefit like dont see talking feel would help anything feeling irrational normal want stop talk wish like nh online service could live chat im good talking speaking saying feel never gonna happen weird youre healthy mind found cancer lump something set nh procedure medicine technology facility etc sort make phonecall appointment say think cancer lump would bring see doctor test stuff get result back pretty quickly bet crippling depression biggy get brushed yeah really fucking need help cant im fucked ask get help,0
born severe asthma allergic nigh everything tested outside sting bite food singulair time tested ish roughly suffer symptom severe anxiety major depression disorder short term memory issue bout schizo affective recently mother shown article referring psychoactive effect singulair people wonder long term use medication may affected development mental health warranted experience medication singulair relation long term depression anxiety,0
hi year old u k past month pretty sure every night pm started cry like worst thing happened even though reason problem making feel like tell anyone around happening make hate even advice may help thanks touchy subject get really upset night reason thought come subreddit help,0
people always say imagine thing u would missed ended life year ago implying anything made feel anything happened since anything gotten worse wish killed year ago,0
past month got pretty bad worse socially academically mood took real dark turn extremely pessimistic starting turn actively suicidal hard live family spent great handful day ready die plan ready learn drive stopping many day tried avoid contact wanted sulk die since yesterday started feeling better grandparent finally got back mexico today counselor talked drastic change grade dad told ever needed help could talk denied anything regarding mental health still feel like deserve die also guess heart admit anyways back feeling usual far back remember guess nice hearing people expressing generosity maybe getting ahead starting go desperate escape still rather dead better know express know like,0
life constant wave failure whenever think thing looking disaster strike stupid ever able pull matter attitude put state suing k garnishing pay pay child support one night stand year ago graduate high school got ged though gf seems like around accept anger life smoke drink another peon job nothing ever done worked long term even though investing year thing given dream live apartment visible future improving living situation child due august barely afford survive compare one accidentally let cat best friend missing since october face world positive outlook typically work hard nothing ever work broken poor monster belong barely scratching surface ready nothing world almost late give one two day top unless see miracle soon done anyone write anything lift spirit late done,0
lately extremely unmotivated little appetite find hard get bed sleep much emotionally drained try happy best avoid problematic friend also incredibly busy life extremely competitive intense program college feel like barely hanging productive motivated happy really struggling advice would appreciated need advice school,0
severely depressed last four month completely isolated friend feel like incapable interesting conversation anyone partner barely anymore make isolate advice please,0
started lexapro mg week ago anxiety gone lot depression still doctor saying strange since two either improve worsen together right waiting week see anything change anyone experienced lower anxiety depression ssri,0
told energy deal anymore shitty daughter enough idek else say really see point anymore told mom wanted die sending live grandparent,0
ok um hello super depressed hence posting thread first place situation want become entrepreneur artist circumstance making pretty hard keep good mindset causing think suicide come worst sometimes ofc would never crazy anyways want decision others life aka mom kind dad want go community college understand already know want life like confident ability become want become currently working hard find job around area reason idk cuz stupid resume trash look like garbage worker idfk anyways get job seems feel like still work doordasher another problem need license permit dad teach drive sometimes teach much gotten ill go hospital couple hour away live get driving lesson cost per lesson money mom close money pay often seems getting driver license literally last foot idk stuck depressed stay inside day trying build tiny as fanbase instagram moved away friend everything known dealing crazy shit head everyday want follow dream subjected something want anyways yeah frustrated leave suggestion tip anything idk still trying get gutter given thanks advance life crisis,0
even describe happy time change weekend normal people understand depressing winter darkness already depressed person spring forward give much energy one excited hell spring forwardddd,0
anxiety shit going world right girlfriend told last night suicidal mate spiralled really dark place drug shit last year high school trying best body issue bunch self doubt kinda get chest anyone going similar stuff happy chat mild depression couple year today everything bit much,0
go mind sleep deprivation coherent sit around home feeling like shit respect parent dismiss anything wrong pouring gas fire passive aggressive every time interact seems like thing might change whether effort environment shifting circle back ride never end look eye tell get better,0
success someone incredibly depressed overcame life fulfilling life anyone success story,0
