selftext_title,is_suicide
going extraordinarily rough year always insecurity self esteem issue really boiled pushed year blame everything like mother passing cancer five year ago began assuming one really wanted around got girlfriend around time unbelievably thankful told lot never able tell anyone else gave lot emotional support helped terrible phase without self harm suicide feel empty scared going lose love go reassurance every day least sad looked guaranteed would feel better talking sure emotion dulled look self hate world despondency general lack interest terrible live exactly interesting still seems preferable die instead live bad scared cut hang love girlfriend lot truly happy rest life pointless point getting better pathetic begging little word say order make feel like somewhat deserve live wondering break kill really point would save hurt long emptiness last,0
psychology student drilled exercise healthy diet proven promote good mental health aid management recovery depression anxiety ignorant assumption proven fact except never worked truly feel depression resistant every level used like sport know grew boob started sweating average person due polycystic ovary even disliked exercise tried hard get jogging sport year hated nearly every second made feel physically terrible could never build resilience could never jog minute took month get point could squat without crippling muscle pain next day matter could never single pushup healthy eating also nothing mood affected eat even coffee anything whether go vegan entire week keep usual carb sugar loaded diet still feel make worse even tried medication make difference untreatable whether due brain chemistry physiology something wrong perception know exercise healthy eating nothing,0
even feel hungry anymore reneging hurt sick honest wish pain could go away love cold depressed mess,0
depression anxiety gotten bad past year honestly think might option wanna start working last job year ago last job worked felt horrible anxiety ridden actually would drink showing helped alot knew day show sober outweighed drunk one id go home feeling even depressed sorry story sleeping right kinda wanted get chest want work happy doin something killing insideanyone know good ok paying job work home,0
know post guess try recently broke ex bit month ago affected mental health lot currently state stand anyone touching getting close person long story anyway recently started started talking bunch people snapchat bit flirting chatting sometimes bit kinda feel like piece shit probably good idea really know anymore,0
bos recently found depression asked best practice manage employee employer relationship web based small company work remotely really think anything taking sick day feel able function wanted see anybody sub idea thanks best practice working depression,0
feel lonely like suffocating partner low insecurity loneliness anxiety pervading thing longer tell unreasonable exhausted unkind know always create problem anyone else always hop new relationship make last way longer become friend never actual circle type outwardly people think friend social situation class seem comfortably around people laugh joke silence never invited anywhere one ever message first try arrange something people bail make excuse see went others kinda stopped trying gave almost hurt tried failed want someone talk want know crazy never suicidal like kinda feel like thing really worth right struggling lot anxiety depression lately thing going wrong professionally amplifying stress feel like school massive impostor syndrome going cap boyfriend extremely confident look determination intelligence completely wrecked grade feel adequate top fact medication screwy hormone place mess alone feel overwhelmed partner told want someone fragile happy tired scared upset feel stuck upset show anymore bad pretending happy feel bad right feel alonei feel alone,0
bit context american black big ugly autistic work aircraft mechanic go every day le see point continuing life one gotten know person want anything people make fun quirk time think funny obnoxious besides friend still one high school far away father man cared anyone else passed away year ago sudden heart kidney failure waiting connecting flight visit besides people connect much need clearly problem know address amount therapy fixed issue people cross street see sidewalk society general like people like many people supporting openly racist president regress know ever able rely cop anything likely get shot figure issue racially profiled many time lived new york city happened stopped every random drug search whenever took staten island ferry carrying backpack case value sort provide society job also vocational training higher qualification every day questioning care money going fix person truth mistake learned year ago adopted birth probably new parent knew would difficult aborted left die prognosis world grows dire every day due global warming facilitated old people give shit u reason believe thing get better people reject science going backwards long gun allow protect know law enforcement also give power choose want die least give peace mind knowing way whenever need starving kid africa whatever bullshit people push discontented still dealt pretty shitty hand life see reason keep bothering many thing wrong future get worse world place people like,0
hi guy long history dealing self harm anger attack focused got self harm way havent done year mental health deteriorating anger attack keep coming back time bad got therapist yes he lot help regarding need tip get rid excess energy usually go run summer cycle shit feel need something different like something break tear apart punch idea tip dealing auto aggression,0
trying many different medication starting think maybe im depressed maybe shitty life sad there nothing done maybe made suffer nothing ever stop feeling maybe way thing maybe people meant sad,0
u even care bout anyone iive fucking pi try nice possible try give people care well mine bc seeing people suffer suck as get return fucking bullshit type shit make wanna kill every day trying make someone day better super nice trying fucking helpful get treated like shit enough always thing everyone always smoke high feeling feel like long lasting warm hug telling enough need take easy sober nice people nice fucking doormat person people shit smoke get away least high comfort chill never fucking anything anyone act like sour bitch people fucking hate give fucking shit complain get fucking face get mad fucking shit always try people never work care thing school hanging productive someone gonna bitch as even hate dislike certain thing nice person always try help guess mostly hate fuck also piece shit well basically rant something bother dont knwo shit make sense since fuckin head foggy hut need get idk trigger warning might idk considerate,0
wish sometimes seen people despise self image done thing improve guess venting post terribly depressed looking mirror seeing unacceptable help hate associating sexuality desirability something ashamed never comfortable look sexuality need escape self image,0
social phobia started year ago worst episode barely left house half year rarely going going really go pharmacy hospital dark still early morning late evening went two group people social phobia individual therapy session therapist got better hard first group getting strongest headache extreme anxiety still get take tranquilliser time started talk people one attended group social anxiety still bad sometimes better sometimes get bad want die cause painful live like felt yesterday really go mall buy partner gift painful experience constantly analysing word behaviour heart pounding stuttering went alone movie like horror hour constantly analysing behaviour word lady work store also ocd anxious public sometimes even take tranquilliser leave house waisting youth depression social phobia wasted year life know people worse experience hope get better start living social anxiety make want die sometimes,0
always make grab phone see battery low notification day good sm network operator fuck month someone initiated real conversation wanted talk fucking sick phone vibration,0
today reached someone know longer time ive depressed two three week without leaving flat much im paid leave im struggling eating althrough force gave schedule like journal exercising meditating cause dont th energy tried reach guy cause feel alone backfired always reinforced im meant hated feel even worse cant stop thinking stayed room better alone,0
wake eat breakfest go school go home nothing hour bed little change realy reason anything everyday didnt want cant normal texting internett care anyway im lonely shy student mean nothing im dissopointment everyone please show right way go edit thank feedback help think day everyday,0
tired money work hour week tired keep bill tired strong one everyone tired go make end meet tired everything parent leave country responsible sibling pay much thing much debt keep everything fucking depressed make seem like okay person know okay girlfriend talk feel anything fucked actually help something make feel better happy deep fucking sad miserable enjoy time fucking suck like want everything end trying hard getting anywhere month much going know keep like going back smoking start alcoholic stage life im tired know anymore tired,0
depressed life time really know go anymore care school anymore also want start working know long go anymore end see reason living everything life suck always worthless human fucked thing many time tried therapy meditation sport nothing seems get better developed bad attitude towards everything completely stopped functioning normal life think ever whats point feel tired,0
hate much cant deal life anymore happy gone wanted talk today mom first word crazy like hear voice went rant eating healthily criticising every meal body made fun fact sporty dont really exercise tried get away go room yelled get back even cry smiling continuing yell calling lazy disgusting maggot hate self much really cant cope year made sensitive really wanna cut cant find knife anywhere gonna kill self cant deal anything anymore person expected unconditionally love hate whole world hate sorry wasting time long rant mom hate,0
need advice people ask irl helping say like think helpful anyway attack scratch arm know bad still bad help little much voice telling try blade scissors go deeper fine stupid common sense push thought away get harder harder say know doi want start cutting,0
week ago thought killing slowly became le frequent felt confident crush girl locker next sometimes make small talk would compliment sometimes felt nice find dating someone else week later didnt even know well felt like slap face fantasy gone feel even lonelier im suicidal thought,0
amazing people life go end earth constantly letting disappointment matter hard try best best let best friend always matter keep disappointing say knew depression letting would never leave think final straw feel like deserves much better time lose destroy deserve lose people love,0
feel right like control nothing okay think today gonna refect thing impending doom think next time see girl imma treasure bit relationship werid special know take care every need real sadness life self inflicted shame really maybe tell love already say lot year best ride either petty moment stayed together craziness met myspace wayyyy back dated week highschool stayed contact year nothing serious one day happened litterally walked car together ever since year later see exactly probably expected worst gotta better gotta better damn forgotten nd chance like th think get th chance ugh emo want like got pull together get girl early sad gt lt week gotta survive,0
ever try better realize toxic one everyone ever known met decided like rather around people ever watch people know grow away closer always piece make sense around look back relationship people remember distinct moment said something pushed away changing opinion like even remember look face say wanna conversation ever realized shitty judgmental selfish individual disguised seemingly normal person ever convince need start okay alone year life still find someone tolerate existence feel cool know friend fault,0
year old kid trying finish second semester college say pretty normal life however january father diagnosed pancreatic cancer long fought battle disease eventually took life january month leading jan missed good portion senior year due help mom nurse day day basis time believe depression first onset getting hour sleep everyday watch father wither away consequentially due missing much school gpa dropped significantly dual credit course time college planned attend lowered college gpa even father passing family began fight money supposedly owed another family member even though proof left rift family hardly hear entire side fast forward graduation summer started smoking weed daily get mind thing became extremely toxic habit spent money fucking plant paraphernalia finally august roll around begin first semester college brief period thing seemingly got better feel empty however month got sinus infection persisted february ultimately surgery around early december began talking beautiful girl really liked hope maybe thing would get better time though started abusing drug would take molly xanax coke percs etc dull pain felt fast forward january rush fraternity starting happen school social life pretty much contingent greek almost necessity house want meet new people make new friend however process extremely competitive well based lot connection house well connected got trouble day rush started could longer take new class inevitably go house connection large school like mine getting bid unlikely put great deal value getting house hoped life would change better unfortunately thing work left empty handed additionally close friend supported point house since little contact top girl talking got amazing house happy meant could see couple day week week rush got extremely sick throwing daily low grade fever mom worried took home hospital doctor told needed surgery within next week fix sinus top also active mononucleosis result missed week school february fell behind almost class finally got back drop class putting scholarship admittance particular school major risk time girl talking began distancing even fast forward today slept midterm required class major meaning good chance need unenroll semester girl talking posting another dude social medium sorry trivial feel like matter hard try life repeatedly beating today broke kid got sat could manage get college verge losing everything worked towards entire life lonely losing one thing made happy really care anyone read get feeling everyday wake cry physically feel awful lonely feel like failure nobody even talk never suicidal,0
rant often like share personal experience regarding anti depressant done individual began taking lexapro symptom depression suicidal thought took long time medication work unfortunately caused terrible stomach problem anxiety terrible since kid needed figure late last november switched prozac worst idea life started dating wonderful girl independent sweet empathetic helped sometimes feel like could fight mental health problem medication started ramping december started throwing breaking thing eventually got physical altercation never life fight another human small guy like confrontation appreciate people irrationally violent well prozac made absolutely violent still coming system feel lessening everyday still seem hold rage stop knee jerk reaction even little thing like hear people say much pain medication helping control anything like doctor promised going start therapy hope curb issue since ten eleven year old back september happy anxious sometimes fell depression got want try anymore medication perfectly fine taking hit dealing prozac made feel like control still sometimes feel like prop girlfriend f left struggle feeling like outcast slept couch two week punishment tell feel say wonder tell prove different want bullshit stop done feeling like want pain stop want anti depressant ruined many good thing,0
way feel better life people sub r drug like seen post know issue drug current addiction heroin last three year went week without hit needle huge accomplishment thanks boyfriend throwing kit even improvement temporary happiness even fading hang boyfriend friend go skating work time feel lower lower like falling try hard happy forget past like sadness stick like glue sort medicine therapy take boost happiness trust antidepressant issue past experience sorry issue english first language happy,0
first foremost readily admit complete shamble human despite turning month time unemployed still live home mother moreover one relationship friend year making two attempt take life diagnosed bpd commonly referred emotionally unstable personality disorder however question validity diagnosis since diagnosed form autism adhd whilst tried numerous type therapy anti depressant past decade still find feeling numb mentally foggy blank sometimes even sense detachment reality know lost,0
want die cant km cause scary living emotionless life without able feel horny happy feel bad thing good life know never go away trying overthink brain better developed average person know stuck rest shitty poor as lazy unimportant boring lifehow get cancer,0
logical side tell work attachment style different anxious need constant reassurance avoidant need constant reassurance pushed away believed said loved illogical side maybe depression talking tell never loved commit waiting someone better come along told wanted hear ugly worthless find someone mile better laugh behind back gullible point genuinely know believe anymore depression warping brain unlovable,0
hate sucked life zero confidence motivation hate way look stick anything feel like constant failure struggle keep house clean forgetful muster energy go exercise make excuse instead fall asleep time forget important stuff worst still half think depression real people make attention hide feeling tried counselling work found cold unsympathetic added problem struggling come term fact abused year narcissistic parent result presently going wringer emotion always told stop cry suck pull together anyone tip help wade sludge maybe see light tunnel changed,0
fucking friday night im completely depressed nothing even interested game atm feel emptyi hate depression,0
dont know reality know false real dont know real persevere reality might make sense even best guess feel way form derealization stemming depression mixed overthinking reality thought like guy feeling every part telling know ridiculous change anything try question true reality gravity time often want test cant much fish spending whole life small lake know nothing massive ocean mile away cant survive seeing beyond shoreline least perceive reality cannot prove real there nothing compare idea drive crazy even question u meaning false would anything even true time erase everything matter dont know feeling false reality dont understand dont know reality false,0
belive weak never imagined ever think something like anymore lost battle tomorrow lose war take tomorrow end,0
would appreciate much one person could talk help maybe need someone talk one talk,0
miscarriage tuesday guy instead spending time decided spend time another girl get drunk sex night smh believe even cry numbhurt,0
think started back middle school grade moved country came north america seen outsider kid targeted easy victim playground bullying learned even managed start playing lunch time kid bullied time middle school came final year grade would enter highschool fear befriended many people could first joined grade highschool would move another highschool different city highschool started sleeping hour day would sit phone washroom hour would take shower bath hour basically turned family stressed finance became emotional punching bag home frustration house would basically result getting earfull sometimes hour gettting yelled yes getting yelled conversation emotionally turned extremely painful teenager trying look place world hoping someone take notice give fuck result began extremely closed would feel lonely matter many people around highschool moved canada state life hit reset button another time would good year friendship started college even college felt disadvantaged student car wore much nicer clothes yezees came one group without pair point starting realizing necessarily privileged parent tried best keep reality depression caught education always basically moving peice meat completely absent mind latched smoking weed daily basis make everything numb wouldnt feel pain could ignore thought obviously good state student got kicked college gpa yes decided move back canada well year iv hell back abused right left employer even hold job mcdonalds grocery store worked construction rain snow blaring sun wind keep going job job never mange get rhythm adult seem get seamlessly borrowed thousand family course past year right dont even enough credit buy decent meal let alone pay rent feel like im hurting everyone around im emotionally stable enough care self oooh mention friend social life well go grab drink cant even afford think twice buying bus ticket feel completely hopeless lost im necessarily suicidal iv suicidal many time thats probably reason wont allow suicidal basically see road see roundabout want give however want run away need someone fucking grab fucking hug never fucking let go need fucking feel like im fucking alive need fucking feel like fucking loved someone fucking biologically told fucking love cant fucking make happy cant fucking make anyone else happy dont know fuck someone please talk ask life give fuck im fucking scaredim ok depressed found self depressed lonely life become part big part depressing life story,0
mental health destroyed person used driven responsible proactive mess gpa fallen significantly since began concentrate anything food taste like shit given social interaction hoping future half time tell lazy mental health stopped seeing counselor shit help hard try describe even describe way anyone would truly understand parent think phase wish phase goddamn tired watching give future tired trying keep panic attack make impossible sleep feeling like world squeezing everything much maybe living much dying way pussy kill wish tired living tired acting like trying get better truth given tiredtired,0
think may actually like sad angry apathetic time shroud use protects people bc always think back really doesnt matter nothing im wont nothing wouldve changed dont want feel good like dont feel im numbi dont want get better,0
idk right sub ask anyone else feel like creative abilites get drained using lexapro cipralex form self therapy always making music day get dark thing keeping sane occupied im medication feel like im desolate middleground im depressed alot anxiety im often completely drained original thought idea im able create stay busy fall back head really suck med given alot help without creative outlet im really nothing cu really going mecreativity ssri depression,0
break cycle go outside house negative stay room day hate someone tell otherwise subconsciously know break cycle,0
love anxiety morning think death realize nothing matter everything go black one day anxiety death,0
really want die would much consequence family would sad friend would wonder bestfriend would blame want burden anybody die want disappear stop existing without causing problem anyone anything wish born first place world beautiful shitty cruel time hate want stop existing,0
http redd pphm v n l jpg http redd pphm v n l jpg cross post r bipolar scale suicidal thought,0
real friend chronic depression alcoholism pushed away nothing holding back coolan interesting realization,0
find true friend always misunderstood seem fit society feel belong anywhere feel like matter never feel like exist human nobody acknowledges presence existence existence nuisance others going die alone feel belong anywhere,0
anyone ever find depression bc eat personally think link gut health mental health thats besides point real question whether buddy could tell antidepressant antianxiety med help enjoy life last year zero interest daily life ie family friend hobby us love im hesitant jump gun get prescribed med majority family mom brother sister bipolar dont think may kind depression disorder ive done diet change ie cutting lactose gluten period time success one point week lol symptom gi problem fatigue day brain fog lseep insomnia suicidal thought id never bc dont want mt family hurt whatever reason every time anything feel akward say loud need kill kinda habitual thing anybody got suggestion med help thing depression single issue related another issue,0
ive fallen really deep state depression one turn family doesnt feel like family treat like shit last night lost thing keeping sane girlfriend kmkw feel anymore pretty much lost everything hadwhat,0
depressed year younger suicidal suicidal get intrusive thought killing especially get driving car wondering ever go away expect forever intrusive thought ever stop,0
