selftext_title,is_suicide
start want apologize rambling possibly repeating similar statement terribly depressed feel lost everything two week ago matched girl f call madlad given completely online dating convinced everyone age looking band aid loneliness chance finding loving relationship like even though low energy reply showed much interest really hit ended asking wanted facetime agreed started facetiming awkward felt emotional connection eachother proceeded next three day facetime hour end homework hanging room live minneapolis go school wisconsin roughly hour half away drove last friday joked saying crazy joking way finally met came hug instantly helped friend move dorm met everyone went dorm sat around homework tension became strong asked wanted watch something got food ended cuddling together enjoying others presence deep conversation said major trust issue although met feel super connected reciprocate feeling quite understand mean trust issue end talking really personally high school boyfriend although know exactly would want say proceed listen comfort laugh say accept challenge trust issue latched onto defend end leaving night feel like went really well wake next morning tend quite overbearing mean good texting master connecting people person responds good morning text feel super great see something responds hesitantly saying scared woke feel let regretting say even though feel right nice guy needed time process response minuscule best help tried relate talk past people effort understand going work going extremely stressed whole time text felt like pushing away decided f deal right end leaving work early drive hour half around pm last saturday call pulled college dorm parking lot saying im sorry didnt want facetime text know said would work long story short drove im parking lot read text call minute later suspense feel like ruined everything call say shes dinner friend doesnt know get back told im sorry leave say without hesitation say want talk want see pause say okay text saying shes sorry shes shock excited see minute pas pull walk car since randomly pull next kind laugh hug quietly walk dorm begin talking everything tell trying cry doesnt want deal really like feel like hurt summary let emotion end cuddling see friend bit feel closer open end leaving tell thank flat rejecting knew felt like knew true knew reject seeing talking person drove home night get pulled going officer hit ticket get home around tell miss begin super overbearing tell got ticket im sorry im waking ruined image getting ticket since first ever run police didnt know say could think would see waited hour night get home safe say didnt ruin anything really liked seeing good sleep woke proceeded text goodmorning thank pushing away kept telling make feel triple scorpio anyone belief know extremely ambitious passionate come impatience great need discipline virgo relapse back hesitation text lightly seems like friend felt afraid opening letting life week go tell shes sorry deal really like see something afraid since shes never treated nice past try hold back say okay care keep telling eachother week much mean one another crazy met facetime tuesday say wanted talk feeling get really deep life want feel eachother whole shabang end call tell talking made feel lot better everything wanted come tomorrow aka wednesday day ago everything feeling better drive class cuddle hour talk want see eachother asks officially dating feel way better everything smile say ofcourse kissing begin makeout go bowling friend group friend really like click super well feel integrated except one girl overly dramatic everyone leave tell thanks great night ill text get home luckily ticket time say goodnight still wait didnt need school night plan hangout weekend drove yesterday work friday spend day eachother cuddle go triple date friend gf bf laugh cringey happy together nothing seems weird go back dorm night hanging everybody asked still okay sleep say ofcourse get comfy get bed begin talking asking still feel etc talk feel safe happy need time makeout go lot farther thought would intimately sex fine since ever make love never want feel like something regret make mistake need advice early night talk love view practical say love first sight love completely rejected completely damaged infatuation love two way thing tell around yesterday today however view dont feel infatuated didnt say knew immediately stopped said dont say get stressed say didnt ruin anything doesnt feel way barely know want take slow makeout etc fondle eachother blah blah ask every question building let go give feel completely destroyed attached grown recognize fall hard know tell say see something long term know family would love wouldnt trying make u work didnt see future really care doesnt want feel regret make mistake go bed wake hour later kissing moving hand shirt etc become fully awake try go move finger stop say fuck beautiful snarky voice hate jokingly say say know im making difficult hold back need help stop go back bed real time say sorry saying thing say okay didnt happen wake start kissing im asleep thing enjoying eacothers touch feel sense physicality love subconsciously say love freak keep mind remember saying half awake fell asleep almost instantly saying didnt really know heard came feeland feeling trying hard say go blank faced next hour wake see distraught ask whats wrong morning way say stupid didnt mean dont know dont know love sit heart aching say asleep didnt mean im sorry say okay proceed cuddle making teasing eachother knowing cant anything soon say im sorry ruining chance coming say okay didnt say anything okay go lunch friend everything feel find doesnt feel like shes rejecting weird way normal smiley happy self get back cuddle fall asleep hour dreamt still destroyed didnt know feel longest time even though religious felt npc controlled god devil letting fate control journey met girl chose make decision cant wait around anything girl someone see rest life matter early may wake get ready leave since want hang friend alone later since one dramatic friend earlier jealous found someone everyone dating somebody say sorry one time tell hiding feeling end rejecting feeling matter real may seem say bye say text get home pm saturday convo go keep mind tell ignoring feel doesnt want think anything tried tell made home madlad okay good hope thing good friend madlad really hope yeah thanks fun weekend madlad know made go downhill lowest could go everything going forward better promise really trusting know going really fast turn slow work everythings alreadu said last thing time goodnight madlad ill stop spamming stuff really mean lot madlad thank knarsan fun weekend heart face emoji minute later madlad friend ditched u im sorry rest night madlad whatever lol shot watching movie lol cool dont drink way trying judgemental dont really participate subculture come dick lot time reddit madlad whats wrong nothing wrong haha safe im saying typing thing slowly dying inside currently listening biggie small ready die album electric light orchestra blue album cry madlad ill safe heart emoji stupid little excited smile emoji madlad im gonna get shitfaced think read dont really know respond dont min later madlad im sorry drink lol dont reason sorry im sorry make feel like im judging madlad dont dont want think le dont still dying inside madlad okay good care judged every little thing dont think would want madlad care ill safe didnt respond thats end story pm completely lost dont know feel react feel want feel etc overthink love addict nature ashamed starting learning experiencing something new really want work dont know could really use sort guide something love thats im hurt dont want push away constant self torment destroys make want look gorge vermont contemplate whether worth anyone ever feel loving embrace someone know probably reacting struggling battle dont know tell since reality friend would trust trust issue never wanted tell since would push away compeltely open sharing dont problem im definitely going weight loneliness depression battling way people others could possibly hurt want feel cared want feel thing crave loving embrace soulmate sorryi feel like ruined chance girl dream,0
envy eats soul every single day debilitating humiliating admit old friend found success happiness virtuous youtubers come see friend random couple holding hand park disgusting much envy ultimate emotional weakness one seven deadly sin biblical matter aside mostly gnawing sucking frosty black hole life center chest honestly rule life decision making practical way rid root depression envy,0
longer trying beat feeling longer trying assert existence accept fear shame humiliation surely point see character play never accept repulsively stupid pretentious fucking dumb excuse human never accept thing like hide run preserve illusion think think,0
want kill alcoholic yeah fucking everyone around wanna end cop took drug got mg valium unlimited vodka gonna get heap panadol wondering many need anyone advzice say nahhh itsorry might triggering,0
past year struggled depression good bad day mainly bad taking photo get better photography personally think photo great although web seem like take edit one day never post friend started youtube channel month ago story always improving never appreciation point year ago majorly debt problem surrounded people hate crushed keeping allowing heal working personal goal thing havnt changed much improved artist one perception changed make realise attitude towards life hurt alone get sad time still feel depressed hugely difference recognise illness self hatred hatred perception world perception point grow take step everyday towards want walk meter everyday le year traveled somewhere recognise stood expect upvotes downvotes maybe even hate think important realise difference cause depression depression cause thanks listeningone thing day,0
deal people take power friend family see vulnerable stop oppressed,0
treated like insignificant irrelevant good enough cared make feel empty proceed look villain maybe care anyone let real nature happened life especially right someone thought cared mean normally made realize okay least really care treating like doormat punching bag care life feel fact completely hurting life thing getting alright feel liek flung whole dimension important even empty cannot even feel relevant real even wann talk physically know man fun feeling completely empty amp absent insignificant hurt f usa,0
endured year wonder much longer last world feel like constructed specifically torture,0
met someone someone really liked say something good first time decade fucked course knew good true got depressed canceled twice today made plan see dumb as depressed slept date hour since apologized written back said could come see response already tired tired self sabotage fucking hate rn thing already point pursuing anymore done worth time action week proven care anymore thought thing looking,0
used suicidal actually ever thought one point life year ago thought thing gotten better truly actually early january feeling best ever felt like life finally moving car job loved passed class another semester horizon string bad luck car broke job seems get stressful day feel like sinking back pit almost four year ago angry bitter nothing cry day know mean therapy best option money pretty sure insurance cover least enough help wish upset time wish lash every minor inconvenience feel like person two month ago far slowly surely bringing right back square one dunno maybe tip help mean point suicide worry gotten back point beginning mess relationship life seems suck soul everything docan get little feedback,0
lately going gym tried adopt healthier habit really done taken place used use escape video game find time day realizing similar every pleasure form escape,0
life like good complain home friend family food table yet fuckinh suicidal depressed idk idk anyone feel like ur done life reason ur sad mentally physically emotionally exhausted know fucking hate killing anyone reading feeling way please lmk deal might honestly ik people reading give fuck say gonna say,0
way least painful far accessible option large amount heroin fentanyl gun would work messy gun heroin either right block easy obtain every day multiple time day consider end,0
never able talk therapist outside school mental health counselor really suck school resource officer amp mental health counselor call parent multiple time told would good idea get anti depressant would help lot minor go parent let get help know getting help,0
give live fake world anymorei want death,0
trying really hard sit study seem exam stress procrastination either tired sleep enough sit focus battling depression bad medicated whole time law school final may start pas matter hard try seem need pas exam need get job move finally free toxic family right feel like even still depressed guess chance going therapy trying eat healthy meditate thing might help nothing seems working pressure killing know exam sort ok barely mental state study though depressed study,0
one love one care everyone either pretend exist bully tried end failed stupid worthless even kill myselfi got nothing,0
think somewhere love like want talk friend never reach make plan initiate thing would never see dad live together make plan see go say hi bye always feel like interupting v program try initiate plan person usually work little walk brunch movie text though never reply even simple love miss feel guilty complaining wanted child bad tried year miscarriage feel like disapointment like turn way wanted changed mind hate feeling like woman deserve child know might sound harsh one deserves feel way make feel make feel like ruined dream know likely depressed like fuck man shit hurt today birthday feeling bad work day time see remembered try see call text birthday guess nothing feel nad shot text ignored usual wanted get somewhere feel guilty complaining know dad best raise grateful terribly depressed question existence every turn feel like product regretful baby fever stupid realize might come way wanted dad accepted mom cannot thing going right try live best life spite maybe one day see happy want peice give shit energy give mom like really contributing depression,0
one understands way feel one talk building inside spent night wondering anyone would noticed answer thing keep dad see year right really want hard explain feel way outside looking life great inside never felt mentally physically drained want live anymore lonely sad feel like got nothing live anymore wish someone would understand hate feeling way,0
therapist told session ago uniquely tuned people emotion inner working empath overly sensitive person everything clicked bought book everything mentioned like empath described life empath also depression like mental torture friend sad stressed see every little thing go way help running grab favorite snack offering go something like ect always described caring thoughtful loving friend find joy helping others yet plummeting dark space end weeping bed hour locked away room isolating soul checked start convincing unloved unwanted thing see much hurting different acting anyone check unfair put sort expectation know communicate better night become consumed thought always someone never never truly seen empath depression torture,0
thank everyone replied love contemplating rn much pussy anything thank,0
quite know exactly going never diagnosed maybe mother take threat bring therapy probably know guilty want reminded eighteen year planet feel like nothing changed planet still dying gas price still going control go world thing could control conscience yet seems impossible even one good mental health week almost instantly hit self doubt insecurity overwhelming idea lonely want way want better overly self aware mental health way react thing way know make feel bad taking time read might asking question know bad control become aware thought evil voice head making believe actually negative thing think constantly put surround negative people toxic mother begin feed whatever saying blame mom slowly forgiving stay mad forever also dealt overbearing emotionally abusive mother hard reciprocation always wrong always right feeling set aside prioritized way thinking influenced past relationship attracted people hurt wanted someone walk feel better tainted way view self worth instead understanding feeling valid regardless anyone say come million reason person making feel bad right always first apologize even one fault endless cycle would anything stop way stop know start hard,0
ever burden ever someone people feel sorry never loved even feel like learning love reality knock sense back know better never worth one ever truly cared energy try anymore never leaf matter matter help get much try done wait waste away tired everyone problem,0
nothing changed tried make think fact thing probably worse progressively getting lazier point even clean room car care clean daily basis mundane bullshit everyday nothing work make easier try tell someone end putting drug vyvanse maybe help laziness due adhd gonna end making happy fact probably get sadder need dependence drug help end dependent yeah maybe better outcome rather take want stuck medication life want creative mind scattering non stop thought like way hectic way beautiful thought happy month turn,0
feel weird feel strong desire end life feel annoyed losing weight seeing going slowly even though eat much even sometimes fast near hour day right mind telling feel fear thinking unknown time strongly feel excited idea future boyfriend make feel good whenever think confused know whether good sign wrong feel like,0
depression kicking as past month recently destroying bad episode becoming sad feel physically sick blaming everything going well know everytime feel like know feel stupid thinking word help help help right help,0
cheated lied girlfriend want kill live hurt disgust manipulated friend personal gain feel like deserve wake tomorrow really want tonight sometime week highly possible hope become better person think want parasite life love want alive want,0
wanting break boyfriend deserves better deserves human functioning brain cry car cry shower simply cry figuring way create death give anyone care ptsd like would feasible drive mile mile mile away unknown location people would think went missing unfortunate accident like hiking falling death due slipping rock suicide much people cope beautiful intelligent superficial bullshit way would want die way would selfish enough something terrible loved one said understand suicide understand depression incredibly selfish thing selfless warped fucked way trying get unescapable cage called brain end ever due fact deep know purpose know reason sometimes though thing called brain thought tell thing make little bit harder step forward depression,0
im sure depression go everything fine week nowhere feel sad almost feel feel brain pounding usually last week gone back normal going abojt year dont know depression type disorder know getting worse worse worse depression kick every nd week,0
death toxic mental loop get stuck cause massive amount paranoia worry take away force really think thing want think start ruminating tripping everyone hate certain deadline joke everything start think become negative repetitive toxic worst part two extremely primitive hate self destruct way quickly able find sort higher consciousness depth expression constantly feel toddler freak head day every used dream neurosis hold back real escape getting super high passing fuck outthe school work combo college make want kill,0
purpose mask concealment shit right well appropriate one find strange feel like wear one time mask made worn time taken area safety comfort get place take mask still one struggle self image problem terribly consistently comparing people always coming short people around constantly undermining causing want stay inside shut world want happy want brave want live life proud tired living lie tired living paina mask,0
one even said goodbye would miss even hope safe trip fuck life really pathetic gonna leaving one even care leaving another state month,0
never far away run still pain matter tell feel okay still stay dying day run away,0
mean group people like judge go stuff together always funny always good time let go movie weekend something like college right kind different people sense introvert hate going party drinking stuff see movie series think fantasy everyone group friend really possible work studying nobody really time quality friendship anymore know miss miss time thing simpleri miss friend,0
people tell worthless add something life idea worth meaning actually want miserable neurotic mess believe ever change want happier non mentally ill version truth version worthless want hang version also exist think ever feel tortured every time say light end tunnel old reach light thirty sixty light end tunnel death co rather skip right want feel affection people supposedly feel fake feel like treated charity case feel like nothing whatsoever fucking broken understand one want around pretend decade half life nice company hurt debilitating tired existential level think remember like feel rested stay go lie friend lie friend standing,0
barely appetite late stomach suffering cant get get food lay feel weak brittle nothing taste good want care thing cant favorite thing anymore nothing really make happy want hug want warmth want feel loved weak sad,0
feel like im overwhelmed underwhelmed time cant find joy anything fucking beat im exhausted come go wish would go im asking advice anything really ill okay want get,0
already use paper plate deodorant wipe thing like help lot still struggle ran paper plate day use dish day sitting sink week wondering anyone tip make cleaning hygiene etc easier tip minimal effort hygiene house cleanliness etc,0
major anxiety im also bi yesterday told crush late night thought told come late night thought tell burden guess anxiety,0
honestly wanna vent last year uni think get anymore crushing think deal keep hiding bathroom hide cry pathetic course close together start last feel inhumane also pedagogical module feel like robot hate curriculum waste day useless seminar many project paper assignment even think get job field wanted prove seems like think get last year,0
almost two month ago prescribed depralin ssri depression benzos anxiety ssri anything fact feel worse worse mental breakdown time since started taking even hope get better ssri anything,0
since suicidal thought nothing changed friend feel distant family treat like shit feel alone feel like one would care comited suicide nothing life changed told one friend pretended care one day didnt talk unless needed something want ask family bring psychologist dont know also feel stupid telling problem people dont wanna drag atention make feel uncomfortable im confused im sad feel realy angry want diei dont wanna alive,0
wanted end thing tonight came incredibly close chickened knew would fail deal consequence still feel rough called helpline given adult mental health team patient spoke mental health nurse told expected change medication tell deal said brain missing serotonin ok soon called nh deemed emergency since go ok since really wanna spend night hospital waiting room chat psychiatrist minute call taker mechanical thing told speak crisis team called local mental health crisis team said speak adult mental health team helpline one called first said take med night listen music mindfully listen clear head weird decided call never asked anything wanted say maybe unreasonable expect called three helplines none worked maybe problem trained healthcare professional volunteer worked feel like lost cause called three different helplines tonight,0
people actually reach kind support single cricket chirping nobody alone dark place,0
today driving class didnt felt like going recent dark thought led mom dad getting super angry telling worthless super unlucky child crazy even one think love maybe even one dont really care dont much friend feel like one truly like want end,0
wish could asleep month everything pure shit right nowi wish could sleep month,0
